{"$schema":"https://json-schema.org/draft/2020-12/schema","title":"External Estimate Snapshot","type":"object","additionalProperties":false,"required":["snapshot_id","source_kind","provider","acquisition_method","domain","period_start","period_end","as_of","evidence","metrics"],"properties":{"snapshot_id":{"type":"string","minLength":1},"source_kind":{"const":"EXTERNAL_ESTIMATED"},"provider":{"enum":["SIMILARWEB_EXPORT","PUBLIC_WEB_ESTIMATE","OTHER_APPROVED_ESTIMATE"]},"acquisition_method":{"enum":["LOCAL_EXPORT","MANUAL_RECORDED"]},"domain":{"type":"string","minLength":3},"period_start":{"type":"string","format":"date"},"period_end":{"type":"string","format":"date"},"as_of":{"type":"string","minLength":1},"evidence":{"type":"array","minItems":1,"items":{"type":"string","minLength":1}},"metrics":{"type":"object","additionalProperties":false,"required":["estimated_visits","bounce_rate","pages_per_visit","average_visit_duration_seconds","channel_shares"],"properties":{"estimated_visits":{"type":"integer","minimum":0},"bounce_rate":{"type":"number","minimum":0,"maximum":1},"pages_per_visit":{"type":"number","minimum":0},"average_visit_duration_seconds":{"type":"integer","minimum":0},"channel_shares":{"type":"object","minProperties":1,"additionalProperties":{"type":"number","minimum":0,"maximum":1}}}}}}
